{"$defs":{"RunActionKind":{"enum":["refresh","logs","replay","cancel","inspect_outputs","review_configuration","none"],"type":"string"},"RunExplanationAction":{"additionalProperties":false,"description":"One suggested next step, without performing a run mutation.","properties":{"kind":{"$ref":"#/$defs/RunActionKind"},"label":{"title":"Label","type":"string"},"reason":{"title":"Reason","type":"string"}},"required":["kind","label","reason"],"title":"RunExplanationAction","type":"object"},"RunState":{"enum":["queued","running","succeeded","failed","canceling","canceled","retrying"],"title":"RunState","type":"string"}},"$id":"urn:dander:control:contracts:v1:run-explanation","$schema":"https://json-schema.org/draft/2020-12/schema","additionalProperties":false,"description":"A bounded explanation derived only from the current normalized run status.","properties":{"available_actions":{"items":{"$ref":"#/$defs/RunActionKind"},"maxItems":7,"title":"Available Actions","type":"array"},"caveats":{"items":{"type":"string"},"maxItems":8,"title":"Caveats","type":"array"},"details":{"items":{"type":"string"},"maxItems":8,"title":"Details","type":"array"},"next_action":{"$ref":"#/$defs/RunExplanationAction"},"results_available":{"title":"Results Available","type":"boolean"},"run_id":{"title":"Run Id","type":"string"},"state":{"$ref":"#/$defs/RunState"},"summary":{"title":"Summary","type":"string"}},"required":["run_id","state","results_available","summary","next_action"],"title":"RunExplanationResponse","type":"object"}
