{"available_actions":["refresh","logs","replay","inspect_outputs"],"caveats":["Recorded counts describe this run; they are not a before/after data comparison.","Runtime telemetry has not been collected for this run.","Replay starts another execution; it does not undo prior writes or repair only a selected date range."],"details":["Recorded extraction: 2 rows from 1 endpoints.","Recorded output: 2 affected rows and 1 models.","Recorded validation and catalog: 1 assertions evaluated and 1 assets."],"next_action":{"kind":"inspect_outputs","label":"Review the pipeline outputs","reason":"Confirm that the recorded output matches the result you expected."},"results_available":true,"run_id":"run-synthetic","state":"succeeded","summary":"The run succeeded and its result measurements are available."}
